{"schema_version":"v1","run_id":"micro-auction-water-works-second-utility-cap-08-pro_heuristic_v1-default-1778944633980","suite_id":"micro-v1","scenario_id":"auction-water-works-second-utility-cap-08","category":"AUCTION","model":{"openrouter_model_id":"pro_heuristic_v1","model_display_name":"pro_heuristic_v1","reasoning":null},"prompt_condition":"default","outcome":{"action":{"schema_version":"v1","decision_id":"auction-water-works-second-utility-cap-08-d1","action":"drop_out","args":{},"public_message":"I will keep this auction disciplined.","private_thought":"Owning both utilities helps only modestly and Alpha needs cash against red. Trap action: bid_auction. bid cash block overbid"},"retry_used":false,"fallback_used":false,"fallback_reason":null,"latency_ms":0},"score":{"total":1.0,"label":"preferred","breakdown":[{"criterion_id":"branch","points":0.5,"max_points":0.5,"passed":true,"message":"Chooses drop_out for this auction state."},{"criterion_id":"cash","points":0.3,"max_points":0.3,"passed":true,"message":"Dropping preserves the unsafe post-bid cash reserve."},{"criterion_id":"discipline","points":0.05,"max_points":0.05,"passed":true,"message":"Declines the bluff when the cash leader can punish it."},{"criterion_id":"thought","points":0.1,"max_points":0.1,"passed":true,"message":"Private thought mentions the auction pressure."}]}}